{
 "entity_id": "CE-000001",
 "entity_status": "active",
 "merged_into": null,
 "canonical_name": "SYNTHETIC EXAMPLE CONSTRUCTION LLC",
 "name_variants": [
  "SYNTHETIC EXAMPLE CONSTRUCTION LLC",
  "SYNTHETIC EXAMPLE CONSTRUCTION INC"
 ],
 "dba_names": [],
 "identity_assertions": [
  {
   "business_source_id": "TBD-030:0000",
   "source_id": "TBD-030",
   "source_priority_class": "tribal_primary",
   "identity_scope": "any_native",
   "relationship_basis": "member",
   "tribal_affiliation_raw": "Tulalip Tribes",
   "identity_claim_text": "SYNTHETIC FIXTURE: TERO-certified Native American-owned business (NAOB Registry); Tribe: Tulalip Tribes; Tulalip Owned: 51%",
   "verification_basis": "TERO_review",
   "ownership_percent": 51.0,
   "assertion_precedence_rank": 1,
   "as_of": "2026-08-27T00:00:00Z",
   "is_current": true
  },
  {
   "business_source_id": "TBD-145:EXAMPLE-0001",
   "source_id": "TBD-145",
   "source_priority_class": "cross_reference",
   "identity_scope": "any_native",
   "relationship_basis": "unspecified",
   "tribal_affiliation_raw": null,
   "identity_claim_text": "Targeted Group vendor, category I (Indigenous American) — illustrative example",
   "verification_basis": "state_certification",
   "ownership_percent": null,
   "assertion_precedence_rank": 4,
   "as_of": "2026-08-27T00:00:00Z",
   "is_current": true
  }
 ],
 "controlling_assertion_id": "TBD-030:0000",
 "native_ownership_status": "tribal_primary_asserted",
 "nations": [
  {
   "nation_id": "bia:tulalip-tribes",
   "nation_name": "Tulalip Tribes",
   "relationship": "citizen",
   "evidence_business_source_ids": [
    "TBD-030:0000"
   ]
  }
 ],
 "certifications": [
  {
   "certifying_source_id": "TBD-030",
   "certification_number": "0000",
   "certification_tier": null,
   "certification_start": null,
   "certification_expiration": null,
   "certification_event_status": "approved",
   "is_current": true
  }
 ],
 "naics": [
  "561720"
 ],
 "service_categories": [
  "Construction"
 ],
 "description": "SYNTHETIC FIXTURE: general construction services (not observed data)",
 "address": "100 Example Way, Exampleville, WA 00000",
 "city": "Exampleville",
 "state_province": "WA",
 "postal_code": "00000",
 "phone": "(555) 555-0100",
 "email": "owner@example.com",
 "website": "www.example.com",
 "field_provenance": {
  "canonical_name": "TBD-030:0000",
  "description": "TBD-030:0000",
  "address": "TBD-030:0000",
  "city": "TBD-030:0000",
  "state_province": "TBD-030:0000",
  "postal_code": "TBD-030:0000",
  "phone": "TBD-030:0000",
  "email": "TBD-030:0000",
  "website": "TBD-030:0000",
  "naics": "TBD-145:EXAMPLE-0001",
  "service_categories": "TBD-030:0000"
 },
 "source_record_ids": [
  "TBD-030:0000",
  "TBD-145:EXAMPLE-0001"
 ],
 "match_edges": [
  {
   "left": "TBD-030:0000",
   "right": "TBD-145:EXAMPLE-0001",
   "method": "exact_website",
   "confidence": 0.97,
   "run_id": "run-2026-08-27-001",
   "reviewed_by": null
  }
 ],
 "conflicts": [],
 "is_current": true,
 "validation_flags": [
  "contains_illustrative_example_record"
 ],
 "review_status": "machine_resolved",
 "resolution_run_id": "run-2026-08-27-001",
 "first_seen": "2026-08-27T00:00:00Z",
 "last_seen": "2026-08-27T00:00:00Z",
 "notes": "SYNTHETIC FIXTURE (replaced 2026-10-04; every name, address and contact value is invented). Shows a TERO NAOB-shaped record joined with an ILLUSTRATIVE Minnesota OSP row to show cross-reference corroboration without identity upgrade. NAICS is the one field sourced from the cross-reference, permitted because it adds a field without touching identity."
}
